<?xml version="1.0" encoding="UTF-8"?>
<dataOrganization xmlns="http://kitdatamanager.net/dama/dataorganization"
                  xmlns:xsi="http://www.w3.org/2001/XMLSchema-instance"
                  xsi:schemaLocation="http://kitdatamanager.net/dama/dataorganization ../dataorganization.xsd">
	<digitalObjectId>b4251d93-ab4f-4410-93f2-8c6859539f69</digitalObjectId>
  <view>
    <root>
        <name>Node name 1</name>
        <children>
            <child>
                <name>Node name 2</name>
                <children>
                    <child>
                        <name>Node name 3</name>
                        <children>
                            <child>
                                <name>Node name 4</name>
                                <logicalFileName>file:///mnt/archive/storage1/234/6324763.png</logicalFileName>
                            </child>
                            <child>
                                <name>Node name 5</name>
                                <logicalFileName>file:///mnt/archive/storage1/234/6324764.png</logicalFileName>
                            </child>
                        </children>
                    </child>
                </children>
            </child>

            <child>
                <name>Node name 6</name>
                <children>
                    <child>
                        <name>Node name 7</name>
                    </child>
                    <child>
                        <name>Node name 8</name>
                        <children>
                            <child>
                                <name>Node name 9</name>
                                <logicalFileName>file:///mnt/archive/storage1/234/6324762.png</logicalFileName>
                            </child>
                        </children>
                    </child>
                    <child>
                        <name>Node name 10</name>
                    </child>
                    <child>
                        <name>Node name 11</name>
                        <children>
                            <child>
                                <name>Node name 12</name>
                                <children>
                                    <child>
                                        <name>Node name 13</name>
                                        <logicalFileName>file:///mnt/archive/storage1/234/6324.png</logicalFileName>
                                    </child>
                                    <child>
                                        <name>Node name 14</name>
                                        <children>
                                            <child>
                                                <name>Node name 15</name>
                                                <logicalFileName>file:///mnt/archive/storage1/234/6.png</logicalFileName>
                                            </child>
                                            <child>
                                                <name>Node name 16</name>
                                                <logicalFileName>file:///mnt/archive/storage1/234/63.png</logicalFileName>
                                            </child>
                                        </children>
                                    </child>
                                    <child>
                                        <name>Node name 17</name>
                                        <logicalFileName>file:///mnt/archive/storage1/234/63.png</logicalFileName>
                                    </child>
                                    <child>
                                        <name>Node name 18</name>
                                        <logicalFileName>file:///mnt/archive/storage1/234/63.png</logicalFileName>
                                    </child>
                                </children>
                            </child>
                            <child>
                                <name>Node name 19</name>
                            </child>
                        </children>
                    </child>
                </children>
            </child>
        </children>
    </root>
	</view>
</dataOrganization>
