<?xml version="1.0" encoding="UTF-8"?>
<dataOrganization xmlns="http://datamanager.kit.edu/dama/dataorganization" xmlns:xs="http://www.w3.org/2001/XMLSchema-instance" xs:schemaLocation="http://datamanager.kit.edu/dama/dataorganization http://datamanager.kit.edu/dama/dataorganization/2015-08/dataorganization.xsd">
    <digitalObjectId>3852284e-17d8-4bc2-a067-d75692a7c94e</digitalObjectId>
    <view xmlns:NS1="http://datamanager.kit.edu/dama/dataorganization" NS1:name="default">
        <root>
            <name/>
            <children>
                <child>
                    <name>Documentation</name>
                    <children>
                        <child>
                            <name>kitten.jpg</name>
                            <logicalFileName>http://ipelsdf1.lsdf.kit.edu/index.php/nav-res-research/nav-res-act-large-scale-data-managment</logicalFileName>
                        </child>
                    </children>
                </child>
            </children>
        </root>
    </view>
    <view xmlns:NS1="http://datamanager.kit.edu/dama/dataorganization" NS1:name="default">
        <root>
            <name/>
            <children>
                <child>
                    <name>custom_view.json</name>
                    <logicalFileName>file:/Users/jejkal/tmp/2016/4/10/admin/e861b2490b46f67bb6639fa24d78e41847c6d3d5/data/custom_view.json</logicalFileName>
                    <attributes>
                        <attribute>
                            <key>size</key>
                            <value>363</value>
                        </attribute>
                        <attribute>
                            <key>lastModified</key>
                            <value>1462884810000</value>
                        </attribute>
                        <attribute>
                            <key>directory</key>
                            <value>false</value>
                        </attribute>
                    </attributes>
                </child>
                <child>
                    <name>default_view.json</name>
                    <logicalFileName>file:/Users/jejkal/tmp/2016/4/10/admin/e861b2490b46f67bb6639fa24d78e41847c6d3d5/data/default_view.json</logicalFileName>
                    <attributes>
                        <attribute>
                            <key>size</key>
                            <value>1018</value>
                        </attribute>
                        <attribute>
                            <key>lastModified</key>
                            <value>1462884810000</value>
                        </attribute>
                        <attribute>
                            <key>directory</key>
                            <value>false</value>
                        </attribute>
                    </attributes>
                </child>
            </children>
        </root>
    </view>
    <view xmlns:NS1="http://datamanager.kit.edu/dama/dataorganization" NS1:name="default">
        <root>
            <name/>
            <children>
                <child>
                    <name>Measurement1</name>
                    <children>
                        <child>
                            <name>image0.tiff</name>
                            <logicalFileName>http://localhost:8080/webdav/1/image0.tiff</logicalFileName>
                        </child>
                        <child>
                            <name>readme.txt</name>
                            <logicalFileName>http://localhost:8080/webdav/1/readme.txt</logicalFileName>
                        </child>
                    </children>
                </child>
                <child>
                    <name>Mesaurement2</name>
                    <children>
                        <child>
                            <name>cent sign ¢, euro sign €, pound sign £</name>
                            <logicalFileName>http://localhost:8080/webdav/2/image1.tiff</logicalFileName>
                        </child>
                        <child>
                            <name>readme.txt</name>
                            <logicalFileName>http://localhost:8080/webdav/2/readme.txt</logicalFileName>
                        </child>
                    </children>
                </child>
            </children>
        </root>
    </view>
</dataOrganization>
